locus_tag,gene_name,product,gene_category,annotation_quality,organism_name,annotation_types,expression_edge_count,significant_up_count,significant_down_count,closest_ortholog_group_size,closest_ortholog_genera,cluster_membership_count,cluster_types,numeric_metric_count,boolean_metric_count,categorical_metric_count,gene_summary,function_description,all_identifiers,numeric_metric_types_observed,boolean_metric_types_observed,categorical_metric_types_observed,compartments_observed,derived_metric_count,derived_metric_value_kinds
PMM1214,gmhB,"D-glycero-D-manno-heptose 1,7-bisphosphate phosphatase",Cell wall and membrane,3,Prochlorococcus MED4,go_bp | go_mf | go_cc | pfam | cog_category | kegg | brite | ec | cyanorak_role | tigr_role,24,3,1,4.0,Prochlorococcus,2,condition_comparison | diel,0,0,0,"gmhB :: D-glycero-D-manno-heptose 1,7-bisphosphate phosphatase :: D,D-heptose 1,7-bisphosphate phosphatase","D,D-heptose 1,7-bisphosphate phosphatase",CK_Pro_MED4_01214 | Q7V0P2 | TX50_RS06545 | WP_011132848.1,,,,,0,
PMM1215,lhgO,FAD/NAD-binding oxidoreductase,Energy production,3,Prochlorococcus MED4,go_mf | go_cc | pfam | cog_category | kegg | brite | ec | tigr_role,24,1,5,3.0,Prochlorococcus,2,condition_comparison | diel,0,0,0,lhgO :: FAD/NAD-binding oxidoreductase :: PFAM FAD dependent oxidoreductase,PFAM FAD dependent oxidoreductase,CK_Pro_MED4_01215 | Q7V0P1 | TX50_RS06550 | WP_011132849.1,,,,,0,
PMM1221,rfaG,"possible alpha-glycosyltransferase, family 4",Cell wall and membrane,3,Prochlorococcus MED4,go_mf | pfam | cog_category | ec,24,1,0,3.0,Prochlorococcus,2,condition_comparison | diel,0,0,0,"rfaG :: possible alpha-glycosyltransferase, family 4 :: transferase activity, transferring glycosyl groups","transferase activity, transferring glycosyl groups",CK_Pro_MED4_01221 | Q7V0N5 | TX50_RS06580 | WP_011132855.1,,,,,0,
PMM1223,,"possible alpha-glycosyltransferase, family 4",Cell wall and membrane,3,Prochlorococcus MED4,go_mf | pfam | cog_category | ec | tigr_role,24,1,5,3.0,Prochlorococcus,2,condition_comparison | diel,0,0,0,"possible alpha-glycosyltransferase, family 4 :: transferase activity, transferring glycosyl groups","transferase activity, transferring glycosyl groups",CK_Pro_MED4_01223 | Q7V0N3 | TX50_RS06590 | WP_011132857.1,,,,,0,
PMM1238,,conserved hypothetical protein,Unknown,1,Prochlorococcus MED4,pfam | cog_category | tigr_role,24,1,1,2.0,Prochlorococcus,2,condition_comparison | diel,0,0,0,conserved hypothetical protein :: Aminoglycoside phosphotransferase,Aminoglycoside phosphotransferase,CK_Pro_MED4_01238 | Q7V0L8 | TX50_RS06665 | WP_011132872.1,,,,,0,
PMM1239,hetA,"ABC transporter type 1, ATPase component",Transport,3,Prochlorococcus MED4,go_bp | go_mf | go_cc | pfam | cog_category | kegg | brite | ec | cyanorak_role | tigr_role,24,1,2,7.0,Prochlorococcus | Synechococcus,2,condition_comparison | diel,7,0,0,"hetA :: ABC transporter type 1, ATPase component :: Alternative locus ID",Alternative locus ID,CK_Pro_MED4_01239 | Q7V0L7 | TX50_RS06670 | WP_011132873.1,damping_ratio | diel_amplitude_protein_log2 | diel_amplitude_transcript_log2 | mascot_identification_probability | peak_time_protein_h | peak_time_transcript_h | protein_transcript_lag_h,,,vesicle | whole_cell,7,numeric
PMM1246,,carbamoyltransferase family protein,Post-translational modification,3,Prochlorococcus MED4,go_bp | go_mf | pfam | cog_category | kegg | tigr_role,24,1,0,5.0,Prochlorococcus,2,condition_comparison | diel,6,0,0,carbamoyltransferase family protein :: Alternative locus ID,Alternative locus ID,CK_Pro_MED4_01246 | Q7V0L0 | TX50_RS06700 | WP_011132880.1,damping_ratio | diel_amplitude_protein_log2 | diel_amplitude_transcript_log2 | peak_time_protein_h | peak_time_transcript_h | protein_transcript_lag_h,,,whole_cell,6,numeric
PMM1248,,conserved hypothetical protein,Unknown,0,Prochlorococcus MED4,,24,4,0,1.0,Prochlorococcus,3,condition_comparison | diel | time_course,0,0,0,conserved hypothetical protein,,CK_Pro_MED4_01248 | Q7V0K8 | TX50_RS06710 | WP_011132882.1,,,,,0,
PMM1249,,conserved hypothetical protein,Unknown,0,Prochlorococcus MED4,,16,1,0,1.0,Prochlorococcus,2,condition_comparison | diel,0,0,0,conserved hypothetical protein :: -,,CK_Pro_MED4_01249 | Q7V0K7 | TX50_RS06715 | WP_011132883.1,,,,,0,
PMM1253,,S-adenosyl-L-methionine-dependent methyltransferase,Secondary metabolites,3,Prochlorococcus MED4,go_bp | go_mf | pfam | cog_category | ec | cyanorak_role | tigr_role,24,1,2,1.0,Prochlorococcus,2,condition_comparison | diel,0,0,0,S-adenosyl-L-methionine-dependent methyltransferase :: methyltransferase,methyltransferase,CK_Pro_MED4_01253 | TX50_RS06735 | WP_152556142.1,,,,,0,
PMM1262,lexA,SOS-response transcriptional repressor,Regulatory functions,3,Prochlorococcus MED4,go_bp | go_mf | go_cc | pfam | cog_category | kegg | brite | ec | cyanorak_role | tigr_role,28,7,5,13.0,Prochlorococcus | Synechococcus,3,condition_comparison | diel | time_course,0,0,0,"lexA :: SOS-response transcriptional repressor :: Represses a number of genes involved in the response to DNA damage (SOS response), including recA and lexA. In the presence of single-stranded DNA, RecA interacts with LexA causing an autocatalytic cleavage which disrupts the DNA-binding part of LexA, leading to derepression of the SOS regulon and eventually DNA repair","Represses a number of genes involved in the response to DNA damage (SOS response), including recA and lexA. In the presence of single-stranded DNA, RecA interacts with LexA causing an autocatalytic cleavage which disrupts the DNA-binding part of LexA, leading to derepression of the SOS regulon and eventually DNA repair",CK_Pro_MED4_01262 | Q7V0J4 | TX50_RS06785 | WP_011132896.1,,,,,0,
PMM1283,,uncharacterized membrane protein,Stress response and adaptation,1,Prochlorococcus MED4,go_cc | pfam | cog_category | kegg | cyanorak_role | tigr_role,32,11,2,13.0,Prochlorococcus | Synechococcus,2,condition_comparison | diel,0,0,0,uncharacterized membrane protein :: Belongs to the BI1 family,Belongs to the BI1 family,CK_Pro_MED4_01283 | Q7V0H4 | TX50_RS06885 | WP_011132917.1,,,,,0,
PMM1304,codA,cytosine deaminase,Amino acid metabolism,3,Prochlorococcus MED4,go_bp | go_mf | pfam | cog_category | kegg | brite | ec | cyanorak_role | tigr_role,27,1,0,13.0,Prochlorococcus | Synechococcus,2,condition_comparison | diel,0,0,0,codA :: cytosine deaminase :: COG402 Cytosine deaminase and related metal-dependent hydrolases Nucleotide transport and metabolism General function prediction only,COG402 Cytosine deaminase and related metal-dependent hydrolases Nucleotide transport and metabolism General function prediction only,CK_Pro_MED4_01304 | Q7V0F8 | TX50_RS06995 | WP_011132938.1,,,,,0,
PMM1307,,conserved hypothetical protein,Unknown,1,Prochlorococcus MED4,cog_category | tigr_role,27,2,3,13.0,Prochlorococcus | Synechococcus,2,condition_comparison | diel,0,0,0,conserved hypothetical protein :: Alternative locus ID,Alternative locus ID,CK_Pro_MED4_01307 | Q7V0F5 | TX50_RS07015 | WP_011132941.1,,,,,0,
PMM1308,ftsQ,cell division protein FtsQ,Cell cycle and division,3,Prochlorococcus MED4,go_bp | go_cc | pfam | cog_category | kegg | cyanorak_role | tigr_role,24,2,0,13.0,Prochlorococcus | Synechococcus,2,condition_comparison | diel,0,0,0,ftsQ :: cell division protein FtsQ :: Alternative locus ID,Alternative locus ID,CK_Pro_MED4_01308 | Q7V0F4 | TX50_RS07020 | WP_011132942.1,,,,,0,
PMM1312,yacL,uncharacterized conserved membrane TRAM and PIN domains containing protein,Unknown,1,Prochlorococcus MED4,go_mf | go_cc | pfam | cog_category | cyanorak_role | tigr_role,27,6,1,13.0,Prochlorococcus | Synechococcus,3,condition_comparison | diel | time_course,0,0,0,yacL :: uncharacterized conserved membrane TRAM and PIN domains containing protein :: Alternative locus ID,Alternative locus ID,CK_Pro_MED4_01312 | Q7V0F3 | TX50_RS07040 | WP_011132946.1,,,,,0,
PMM1313,clpP4,"ATP-dependent Clp protease, protease subunit",Post-translational modification,3,Prochlorococcus MED4,go_bp | go_mf | go_cc | pfam | cog_category | kegg | brite | ec | cyanorak_role | tigr_role,32,7,0,13.0,Prochlorococcus | Synechococcus,3,condition_comparison | diel | time_course,6,0,0,"clpP4 :: ATP-dependent Clp protease, protease subunit :: Cleaves peptides in various proteins in a process that requires ATP hydrolysis. Has a chymotrypsin-like activity. Plays a major role in the degradation of misfolded proteins",Cleaves peptides in various proteins in a process that requires ATP hydrolysis. Has a chymotrypsin-like activity. Plays a major role in the degradation of misfolded proteins,CK_Pro_MED4_01313 | Q7V0F2 | TX50_RS07045 | WP_011132947.1 | clpP,damping_ratio | diel_amplitude_protein_log2 | diel_amplitude_transcript_log2 | peak_time_protein_h | peak_time_transcript_h | protein_transcript_lag_h,,,whole_cell,6,numeric
PMM1322,glgX,isoamylase,Carbohydrate metabolism,3,Prochlorococcus MED4,go_bp | go_mf | pfam | cog_category | kegg | brite | ec | cyanorak_role | tigr_role,27,4,0,13.0,Prochlorococcus | Synechococcus,2,condition_comparison | diel,0,0,0,glgX :: isoamylase :: Belongs to the glycosyl hydrolase 13 family,Belongs to the glycosyl hydrolase 13 family,CK_Pro_MED4_01322 | Q7V0E4 | TX50_RS07095 | WP_011132956.1,,,,,0,
PMM1324,ycf63,"ABC-type transport system, membrane component",Secondary metabolites,3,Prochlorococcus MED4,go_mf | go_cc | pfam | cog_category | kegg | brite | tigr_role,27,1,2,13.0,Prochlorococcus | Synechococcus,2,condition_comparison | diel,0,0,0,"ycf63 :: ABC-type transport system, membrane component :: membrane component",membrane component,CK_Pro_MED4_01324 | Q7V0E2 | TX50_RS07110 | WP_011132958.1,,,,,0,
PMM1333,msrA2,peptide methionine sulfoxide reductase,Stress response and adaptation,3,Prochlorococcus MED4,go_bp | go_mf | pfam | cog_category | kegg | brite | ec | cyanorak_role | tigr_role,27,3,2,13.0,Prochlorococcus | Synechococcus,2,condition_comparison | diel,0,0,0,msrA2 :: peptide methionine sulfoxide reductase :: Has an important function as a repair enzyme for proteins that have been inactivated by oxidation. Catalyzes the reversible oxidation-reduction of methionine sulfoxide in proteins to methionine,Has an important function as a repair enzyme for proteins that have been inactivated by oxidation. Catalyzes the reversible oxidation-reduction of methionine sulfoxide in proteins to methionine,CK_Pro_MED4_01333 | Q7V0D3 | TX50_RS07155 | WP_011132967.1 | msrA,,,,,0,
PMM1342,kaiC,circadian clock protein KaiC,Cellular processes,3,Prochlorococcus MED4,go_bp | go_mf | pfam | cog_category | kegg | ec | cyanorak_role | tigr_role,31,1,0,13.0,Prochlorococcus | Synechococcus,2,condition_comparison | diel,0,0,0,"kaiC :: circadian clock protein KaiC :: Core component of the KaiBC clock protein complex, which constitutes the main circadian regulator in cyanobacteria. Binds to DNA. The KaiBC complex may act as a promoter-nonspecific transcription regulator that represses transcription, possibly by acting on the state of chromosome compaction","Core component of the KaiBC clock protein complex, which constitutes the main circadian regulator in cyanobacteria. Binds to DNA. The KaiBC complex may act as a promoter-nonspecific transcription regulator that represses transcription, possibly by acting on the state of chromosome compaction",CK_Pro_MED4_01342 | TX50_RS07200 | WP_011132976.1,,,,,0,
PMM1349,rnz,ribonuclease Z,Transcription,3,Prochlorococcus MED4,go_bp | go_mf | pfam | cog_category | kegg | brite | ec | cyanorak_role | tigr_role,32,3,0,13.0,Prochlorococcus | Synechococcus,3,condition_comparison | diel | time_course,0,0,0,"rnz :: ribonuclease Z :: Zinc phosphodiesterase, which displays some tRNA 3^- processing endonuclease activity. Probably involved in tRNA maturation, by removing a 3^-trailer from precursor tRNA","Zinc phosphodiesterase, which displays some tRNA 3^- processing endonuclease activity. Probably involved in tRNA maturation, by removing a 3^-trailer from precursor tRNA",CK_Pro_MED4_01349 | TX50_RS07235 | WP_011132983.1,,,,,0,
PMM1355,,conserved hypothetical protein,Stress response and adaptation,1,Prochlorococcus MED4,cog_category | cyanorak_role | tigr_role,27,1,2,13.0,Prochlorococcus | Synechococcus,2,condition_comparison | diel,0,0,0,conserved hypothetical protein :: Alternative locus ID,Alternative locus ID,CK_Pro_MED4_01355 | Q7V0B4 | TX50_RS07265 | WP_011132989.1,,,,,0,
PMM1362,,conserved hypothetical protein,Unknown,1,Prochlorococcus MED4,cog_category | cyanorak_role | tigr_role,25,1,1,4.0,Prochlorococcus,2,condition_comparison | diel,0,0,0,conserved hypothetical protein :: Alternative locus ID,Alternative locus ID,CK_Pro_MED4_01362 | Q7V0A7 | TX50_RS07305 | WP_011132996.1,,,,,0,
PMM1363,,conserved hypothetical protein,Unknown,1,Prochlorococcus MED4,pfam | cog_category,19,2,1,1.0,Prochlorococcus,3,condition_comparison | diel | time_course,0,0,0,conserved hypothetical protein :: Alternative locus ID,Alternative locus ID,CK_Pro_MED4_01363 | TX50_RS09365 | WP_036930502.1,,,,,0,
PMM1366,pirA,pirin-like protein,Stress response and adaptation,3,Prochlorococcus MED4,go_mf | pfam | cog_category | kegg | brite | ec | cyanorak_role | tigr_role,24,3,1,7.0,Prochlorococcus | Synechococcus,2,condition_comparison | diel,0,0,0,pirA :: pirin-like protein :: Belongs to the pirin family,Belongs to the pirin family,CK_Pro_MED4_01366 | Q7V0A3 | TX50_RS07330 | WP_011133000.1,,,,,0,
PMM1370,,"flavoprotein, HI0933 family",Unknown,3,Prochlorococcus MED4,go_mf | pfam | cog_category | kegg | brite | cyanorak_role | tigr_role,24,1,0,13.0,Prochlorococcus | Synechococcus,2,condition_comparison | diel,0,0,0,"flavoprotein, HI0933 family :: Alternative locus ID",Alternative locus ID,CK_Pro_MED4_01370 | Q7V099 | TX50_RS07350 | WP_011133004.1,,,,,0,
PMM1376,rbpD,nucleotide-binding alpha-beta plait domain-containing protein,Transcription,3,Prochlorococcus MED4,go_bp | go_mf | pfam | cog_category | cyanorak_role | tigr_role,19,1,1,6.0,Prochlorococcus | Synechococcus,2,condition_comparison | diel,0,0,0,rbpD :: nucleotide-binding alpha-beta plait domain-containing protein :: RNA recognition motif,RNA recognition motif,CK_Pro_MED4_01376 | Q7V094 | TX50_RS07395 | WP_011133010.1,,,,,0,
PMM1378,desA3,delta-12 fatty acid desaturase DesA3,Stress response and adaptation,3,Prochlorococcus MED4,go_bp | go_mf | go_cc | pfam | cog_category | kegg | brite | ec | cyanorak_role | tigr_role,25,3,2,11.0,Prochlorococcus | Synechococcus,2,condition_comparison | diel,0,0,0,desA3 :: delta-12 fatty acid desaturase DesA3 :: fatty acid desaturase,fatty acid desaturase,CK_Pro_MED4_01378 | Q7V092 | TX50_RS07405 | WP_011133012.1 | des | yocE,,,,,0,
PMM1384,hli,high light inducible protein,Stress response and adaptation,3,Prochlorococcus MED4,go_bp | go_cc | pfam | cog_category | cyanorak_role | tigr_role,22,12,2,19.0,Prochlorococcus,3,condition_comparison | diel | time_course,0,0,0,hli :: high light inducible protein :: Alternative locus ID,Alternative locus ID,CK_Pro_MED4_01384 | Q7TTL7 | TX50_RS07445 | WP_011132751.1 | hli12 | hli4,,,,,0,
PMM1385,hli,high light inducible protein,Stress response and adaptation,2,Prochlorococcus MED4,go_bp | go_cc | cog_category | cyanorak_role | tigr_role,24,12,2,24.0,Prochlorococcus,3,condition_comparison | diel | time_course,0,0,0,hli :: high light inducible protein :: Alternative locus ID,Alternative locus ID,CK_Pro_MED4_01385 | Q7V086 | TX50_RS07450 | WP_011133018.1 | hli11,,,,,0,
PMM1387,,conserved hypothetical protein,Unknown,1,Prochlorococcus MED4,pfam | cog_category,20,6,1,4.0,Prochlorococcus,2,condition_comparison | diel,0,0,0,conserved hypothetical protein :: Alternative locus ID,Alternative locus ID,CK_Pro_MED4_01387 | Q7V084 | TX50_RS07460 | WP_011133020.1,,,,,0,
PMM1390,hli,high light inducible protein,Stress response and adaptation,3,Prochlorococcus MED4,go_bp | go_cc | pfam | cog_category | cyanorak_role | tigr_role,27,9,0,10.0,Prochlorococcus,3,condition_comparison | diel | time_course,0,0,0,hli :: high light inducible protein :: Alternative locus ID,Alternative locus ID,CK_Pro_MED4_01390 | TX50_RS07475 | WP_042116249.1,,,,,0,
PMM1391,,ribbon helix-helix domain containing protein,Regulatory functions,2,Prochlorococcus MED4,go_bp | cyanorak_role | tigr_role,31,13,1,1.0,Prochlorococcus,3,condition_comparison | diel | time_course,0,0,0,ribbon helix-helix domain containing protein :: -,,CK_Pro_MED4_01391 | Q7TU53 | TX50_RS07480 | WP_011133024.1,,,,,0,
PMM1392,,possible Heat-labile enterotoxin alpha chain,Unknown,2,Prochlorococcus MED4,cog_category | cyanorak_role,27,4,1,3.0,Prochlorococcus,2,condition_comparison | diel,0,0,0,possible Heat-labile enterotoxin alpha chain :: Heat-labile enterotoxin alpha chain,Heat-labile enterotoxin alpha chain,CK_Pro_MED4_01392 | Q7TU52 | TX50_RS07485 | WP_011133025.1,,,,,0,
PMM1395,,conserved hypothetical protein,Unknown,0,Prochlorococcus MED4,,19,3,1,1.0,Prochlorococcus,2,condition_comparison | diel,0,0,0,conserved hypothetical protein :: -,,CK_Pro_MED4_01395 | Q7V080 | TX50_RS07500 | WP_011133028.1,,,,,0,
PMM1400,,RmlC-like cupin domain-containing protein,Post-translational modification,2,Prochlorococcus MED4,pfam | cog_category | cyanorak_role | tigr_role,38,17,6,10.0,Prochlorococcus | Synechococcus,3,condition_comparison | diel | time_course,0,0,0,RmlC-like cupin domain-containing protein :: Alternative locus ID,Alternative locus ID,CK_Pro_MED4_01400 | Q7TU50 | TX50_RS07530 | WP_011133029.1,,,,,0,
PMM1403,,HNH endonuclease family protein,Replication and repair,3,Prochlorococcus MED4,go_mf | pfam | cog_category | cyanorak_role | tigr_role,29,10,1,14.0,Prochlorococcus | Synechococcus,3,condition_comparison | diel | time_course,0,0,0,HNH endonuclease family protein :: HNH endonuclease HNH nuclease,HNH endonuclease HNH nuclease,CK_Pro_MED4_01403 | Q7V077 | TX50_RS07550 | WP_011133032.1,,,,,0,
PMM1404,hli,high light inducible protein,Stress response and adaptation,2,Prochlorococcus MED4,go_bp | go_cc | cyanorak_role | tigr_role,34,20,3,24.0,Prochlorococcus,3,condition_comparison | diel | time_course,0,0,0,hli :: high light inducible protein :: -,,CK_Pro_MED4_01404 | Q7V076 | TX50_RS07555 | WP_011133033.1 | hli5,,,,,0,
PMM1416,PsiP1,phosphate starvation inducible protein 1,Stress response and adaptation,2,Prochlorococcus MED4,pfam | cog_category | cyanorak_role | tigr_role,39,5,0,2.0,Prochlorococcus | Synechococcus,2,condition_comparison | diel,0,0,0,PsiP1 :: phosphate starvation inducible protein 1 :: calcium- and calmodulin-responsive adenylate cyclase activity,calcium- and calmodulin-responsive adenylate cyclase activity,CK_Pro_MED4_01416 | Q7V066 | TX50_RS07630 | WP_011133045.1,,,,,0,
PMM1418,,conserved hypothetical protein,Unknown,1,Prochlorococcus MED4,pfam | cog_category | kegg | brite,16,1,0,2.0,Prochlorococcus,2,condition_comparison | diel,0,0,0,"conserved hypothetical protein :: Type VI secretion system VasI, EvfG, VC_A0118","Type VI secretion system VasI, EvfG, VC_A0118",CK_Pro_MED4_01418 | Q7TU47 | TX50_RS07640 | WP_011133047.1,,,,,0,
PMM1423,,glutaredoxin family protein,Energy production,3,Prochlorococcus MED4,go_bp | go_mf | go_cc | pfam | cog_category | tigr_role,27,5,0,6.0,Prochlorococcus | Synechococcus,2,condition_comparison | diel,0,0,0,glutaredoxin family protein :: Glutaredoxin,Glutaredoxin,CK_Pro_MED4_01423 | Q7V062 | TX50_RS07670 | WP_011133052.1,,,,,0,
PMM1424,,possible Uncharacterized protein family UPF003,Unknown,2,Prochlorococcus MED4,,31,13,1,4.0,Prochlorococcus,2,condition_comparison | diel,0,0,0,possible Uncharacterized protein family UPF003 :: -,,CK_Pro_MED4_01424 | Q7V061 | TX50_RS07675 | WP_011133053.1,,,,,0,
PMM1427,,conserved hypothetical protein,Unknown,1,Prochlorococcus MED4,cog_category | cyanorak_role | tigr_role,19,10,5,14.0,Prochlorococcus | Synechococcus,2,condition_comparison | time_course,0,0,0,conserved hypothetical protein :: Alternative locus ID,Alternative locus ID,CK_Pro_MED4_01427 | Q7V058 | TX50_RS09330 | WP_011133056.1,,,,,0,
PMM1428,,EVE domain protein,Unknown,3,Prochlorococcus MED4,go_mf | pfam | cog_category | tigr_role,35,4,1,13.0,Prochlorococcus | Synechococcus,3,condition_comparison | diel | time_course,0,0,0,EVE domain protein :: Alternative locus ID,Alternative locus ID,CK_Pro_MED4_01428 | Q7V057 | TX50_RS07695 | WP_011133057.1,,,,,0,
PMM1434,gpmI,"2,3-bisphosphoglycerate-independent phosphoglycerate mutase",Carbohydrate metabolism,3,Prochlorococcus MED4,go_bp | go_mf | go_cc | pfam | cog_category | kegg | brite | ec | cyanorak_role | tigr_role,34,4,5,13.0,Prochlorococcus | Synechococcus,3,condition_comparison | diel | time_course,0,0,0,"gpmI :: 2,3-bisphosphoglycerate-independent phosphoglycerate mutase :: Catalyzes the interconversion of 2-phosphoglycerate and 3-phosphoglycerate",Catalyzes the interconversion of 2-phosphoglycerate and 3-phosphoglycerate,CK_Pro_MED4_01434 | TX50_RS07725 | WP_011133063.1,,,,,0,
PMM1442,pepP,Xaa-Pro aminopeptidase,Post-translational modification,3,Prochlorococcus MED4,go_bp | go_mf | go_cc | pfam | cog_category | kegg | brite | ec | cyanorak_role | tigr_role,31,5,0,13.0,Prochlorococcus | Synechococcus,3,condition_comparison | diel | time_course,0,0,0,pepP :: Xaa-Pro aminopeptidase :: Belongs to the peptidase M24B family,Belongs to the peptidase M24B family,CK_Pro_MED4_01442 | Q7V046 | TX50_RS07760 | WP_011133071.1,,,,,0,
PMM1443,,CBS and DUF21 domain-containing protein,Unknown,3,Prochlorococcus MED4,go_cc | pfam | cog_category | cyanorak_role | tigr_role,27,4,1,13.0,Prochlorococcus | Synechococcus,2,condition_comparison | diel,0,0,0,CBS and DUF21 domain-containing protein :: Alternative locus ID,Alternative locus ID,CK_Pro_MED4_01443 | Q7V045 | TX50_RS07765 | WP_011133072.1,,,,,0,
PMM1458,ftsW,cell division protein FtsW,Cell cycle and division,3,Prochlorococcus MED4,go_bp | go_mf | go_cc | pfam | cog_category | kegg | brite | ec | cyanorak_role | tigr_role,16,1,0,13.0,Prochlorococcus | Synechococcus,2,condition_comparison | diel,0,0,0,ftsW :: cell division protein FtsW :: Peptidoglycan polymerase that is essential for cell division,Peptidoglycan polymerase that is essential for cell division,CK_Pro_MED4_01458 | Q7V030 | TX50_RS07840 | WP_011133086.1,,,,,0,
PMM1464,tly,ribosomal RNA methyltransferase FtsJ family,Translation,3,Prochlorococcus MED4,go_bp | go_mf | pfam | cog_category | kegg | brite | ec | cyanorak_role | tigr_role,24,1,0,13.0,Prochlorococcus | Synechococcus,2,condition_comparison | diel,0,0,0,tly :: ribosomal RNA methyltransferase FtsJ family :: Alternative locus ID,Alternative locus ID,CK_Pro_MED4_01464 | Q7TU41 | TX50_RS07870 | WP_011133092.1,,,,,0,
PMM1467,ski2,"ATP-dependent DNA/RNA helicase, superfamily 1/2",Replication and repair,3,Prochlorococcus MED4,go_bp | go_mf | go_cc | pfam | cog_category | ec | cyanorak_role | tigr_role,24,1,0,13.0,Prochlorococcus | Synechococcus,2,condition_comparison | diel,0,0,0,"ski2 :: ATP-dependent DNA/RNA helicase, superfamily 1/2 :: Alternative locus ID",Alternative locus ID,CK_Pro_MED4_01467 | Q7V023 | TX50_RS07885 | WP_011133095.1,,,,,0,
PMM1468,bioF,8-amino-7-oxononanoate synthase,Coenzyme metabolism,3,Prochlorococcus MED4,go_bp | go_mf | pfam | cog_category | kegg | brite | ec | cyanorak_role | tigr_role,24,1,0,13.0,Prochlorococcus | Synechococcus,2,condition_comparison | diel,0,0,0,bioF :: 8-amino-7-oxononanoate synthase,8-amino-7-oxononanoate synthase,CK_Pro_MED4_01468 | Q7V022 | TX50_RS07890 | WP_011133096.1,,,,,0,
PMM1469,bioH,pimeloyl-[acyl-carrier protein] methyl ester esterase,Coenzyme metabolism,3,Prochlorococcus MED4,go_bp | go_mf | pfam | cog_category | kegg | brite | ec | cyanorak_role | tigr_role,24,2,3,13.0,Prochlorococcus | Synechococcus,2,condition_comparison | diel,0,0,0,bioH :: pimeloyl-[acyl-carrier protein] methyl ester esterase :: carboxylic ester hydrolase activity,carboxylic ester hydrolase activity,CK_Pro_MED4_01469 | Q7V021 | TX50_RS07895 | WP_011133097.1,,,,,0,
PMM1473,,conserved hypothetical protein,Unknown,1,Prochlorococcus MED4,pfam | cog_category | tigr_role,16,1,1,11.0,Prochlorococcus | Synechococcus,2,condition_comparison | diel,0,0,0,conserved hypothetical protein :: Alternative locus ID,Alternative locus ID,CK_Pro_MED4_01473 | Q7V018 | TX50_RS07915 | WP_011133101.1,,,,,0,
PMM1474,dnaJ5,DnaJ type III chaperone protein,Post-translational modification,3,Prochlorococcus MED4,go_bp | go_mf | pfam | cog_category | cyanorak_role | tigr_role,24,2,0,13.0,Prochlorococcus | Synechococcus,2,condition_comparison | diel,0,0,0,dnaJ5 :: DnaJ type III chaperone protein :: Alternative locus ID,Alternative locus ID,CK_Pro_MED4_01474 | Q7V017 | TX50_RS07920 | WP_011133102.1,,,,,0,
PMM1476,,NADP-dependent oxidoreductase,Unknown,3,Prochlorococcus MED4,go_mf | pfam | cog_category | kegg | cyanorak_role | tigr_role,24,2,1,13.0,Prochlorococcus | Synechococcus,2,condition_comparison | diel,0,0,0,NADP-dependent oxidoreductase :: aldo keto reductase family,aldo keto reductase family,CK_Pro_MED4_01476 | Q7V015 | TX50_RS07930 | WP_011133104.1,,,,,0,
PMM1477,fer,3Fe-4S ferredoxin,Stress response and adaptation,3,Prochlorococcus MED4,go_bp | go_mf | pfam | cog_category | kegg | cyanorak_role | tigr_role,19,3,0,13.0,Prochlorococcus | Synechococcus,2,condition_comparison | diel,0,0,0,fer :: 3Fe-4S ferredoxin :: Ferredoxins are iron-sulfur proteins that transfer electrons in a wide variety of metabolic reactions,Ferredoxins are iron-sulfur proteins that transfer electrons in a wide variety of metabolic reactions,CK_Pro_MED4_01477 | Q7V014 | TX50_RS07935 | WP_011133105.1,,,,,0,
PMM1478,ycf35,regulator of CO2 utilization Ycf35,Photosynthesis,2,Prochlorococcus MED4,pfam | cog_category | cyanorak_role | tigr_role,27,2,0,13.0,Prochlorococcus | Synechococcus,2,condition_comparison | diel,0,0,0,ycf35 :: regulator of CO2 utilization Ycf35 :: Alternative locus ID,Alternative locus ID,CK_Pro_MED4_01478 | Q7V013 | TX50_RS07940 | WP_011133106.1,,,,,0,
